ticker,date,time,news,news_url,T,T-1,T-2,T-3,T-4,T-5,T-6,T-7,T-8,T-9,T-10,T-11,T-12,T-13,T-14,T-15,T-16,T-17,T-18,T-19,T-20,T-21,T-22,T-23,T-24,T-25,T-26,T-27,T-28,T-29,T-30,T+1,pct_change
MVID,2025-09-08,14:20,"Доля собственного маркетплейса в онлайн-продажах М.Видео-Эльдорадо впервые достигла 10% в августе 2025 года — компания || Сегодня СД М.Видео рассмотрит вопрос об изменении размещения дополнительных ценных бумаг с закрытой подписки на открытую || 📉Акции М.Видео снижались более, чем на 5% на новости о возможной смене подписки по допэмиссии с закрытой на открытую",https://smart-lab.ru/blog/1202040.php || https://smart-lab.ru/blog/1202182.php || https://smart-lab.ru/blog/1202215.php,86.4,91.6,92.85,92.3,92.05,92.7,93.35,95.2,94.65,94.1,94.1,93.05,94.95,96.6,97.0,97.5,97.4,97.4,99.5,94.3,94.0,89.75,90.3,89.3,89.95,88.3,88.2,88.1,87.9,88.35,89.6,86.18408963914032,-0.25
MVID,2025-09-09,13:19,"СД М.Видео: Цена акций при допэмиссии будет определена после окончания срока действия преимущественного права приобретения размещаемых акций, ВОСА - 13 октября",https://smart-lab.ru/blog/1202659.php,88.0,90.2,91.6,92.85,92.3,92.05,92.7,93.35,95.2,94.65,94.1,94.1,93.05,94.95,96.6,97.0,97.5,97.4,97.4,99.5,94.3,94.0,89.75,90.3,89.3,89.95,88.3,88.2,88.1,87.9,88.35,87.4374762781351,-0.64
MVID,2025-09-11,7:50,"Рост оборота 10 крупнейших ритейлеров в I полугодии 2025 года составил ₽6,8 трлн, замедлившись до 14,1% с 22,2% годом ранее — исследование Infoline — Ведомости",https://smart-lab.ru/blog/1203453.php,89.9,91.45,87.05,90.2,91.6,92.85,92.3,92.05,92.7,93.35,95.2,94.65,94.1,94.1,93.05,94.95,96.6,97.0,97.5,97.4,97.4,99.5,94.3,94.0,89.75,90.3,89.3,89.95,88.3,88.2,88.1,89.45860554858771,-0.49
MVID,2025-10-31,13:48,"❗
СД ""М.Видео"" утвердил проспект допэмиссии акций, подтверждает планы по размещению до конца года || СД М.Видео утвердил проспект допэмиссии акций, подтверждает планы по размещению до конца года — Интерфакс",https://t.me/markettwits/346216 || https://smart-lab.ru/blog/1224762.php,62.4,63.5,63.05,63.05,62.7,63.6,63.4,63.75,64.4,64.9,65.2,65.5,61.25,61.55,62.85,62.8,63.5,63.35,64.65,63.6,60.3,64.65,65.95,75.9,57.9,59.05,59.35,59.6,59.5,60.4,79.25,61.87729113179476,-0.84
MVID,2025-11-24,13:09,"Продажи электроники и бытовой техники в России по итогам 10М 2025 года сократились на 9% в денежном выражении. При этом натуральный объём рынка вырос всего на 1,7% — Ъ || М.Видео фиксирует рост спроса на восстановленные смартфоны: по итогам 9 мес 2025г продажи выросли на 160% в количественном и на 140% в денежном выражении г/г",https://smart-lab.ru/blog/1233905.php || https://smart-lab.ru/blog/1234102.php,66.4,65.0,63.2,63.65,62.65,61.35,62.25,62.85,62.7,62.2,62.15,62.85,61.6,62.2,62.75,62.85,62.45,63.5,63.05,63.05,62.7,63.6,63.4,63.75,64.4,64.9,65.2,65.5,61.25,61.55,62.85,66.53958052580533,0.21
MVID,2025-11-27,9:22,"Акции ДОМ.РФ, Озона и ЦИАНа с 19 декабря войдут в Индекс МосБиржи, Юнипро исключат, в базу Индекса голубых фишек войдут акции Озона и ВТБ — Мосбиржа меняет базы расчета Индексов || Акции ДОМ.РФ, Озона и ЦИАНа с 19 декабря войдут в Индекс МосБиржи, Юнипро исключат, в базу Индекса голубых фишек войдут акции Озона и ВТБ — Мосбиржа меняет базы расчета Индексов",https://smart-lab.ru/blog/1235602.php || https://smart-lab.ru/blog/1235602.php,66.15,65.0,63.2,63.65,62.65,61.35,62.25,62.85,62.7,62.2,62.15,62.85,61.6,62.2,62.75,62.85,62.45,63.5,63.05,63.05,62.7,63.6,63.4,63.75,64.4,64.9,65.2,65.5,61.25,61.55,62.85,65.64060349002241,-0.77
